stage_or_issue,why_it_matters,deployment_implication,preferred_response,references
Production route and solvent choice,"UiO-66-NH2 burdens change markedly with the synthesis route, especially when moving away from DMF-intensive solvothermal processing",Cradle-to-gate environmental burden and production cost can change dramatically with route selection,"Report the exact synthesis route and solvent-recovery assumptions; prioritise aqueous, solvent-free, or mechanochemical routes where performance is retained",(5-8)
UiO-66 as a membrane material,"Even when UiO-66-NH2 is used as a membrane component or MMM filler rather than as a bulk adsorbent, its production route still strongly affects environmental burden and cost.",Membrane studies should not treat the MOF contribution as a fixed or negligible background input,Use route-specific inventory data for UiO-66-based membrane materials in LCA/TEA comparisons,(8)
Shaping and structured deployment,"UiO-66 is usually studied as a powder, but real deployment requires pellets, monoliths, beads, or structured adsorbents","Powder metrics alone are not enough for practical sustainability claims, because shaping affects properties and process-level performance","Include shaping/formulation effects and evaluate structured materials, not only pristine powders","(11,12)"
Regeneration duty and operating conditions,"UiO-66 sustainability depends on working capacity and regeneration conditions under realistic gas compositions, not only on equilibrium uptake under ideal conditions","Use-phase energy can dominate total impacts per tonne of CO2 captured if regeneration requires deep vacuum, high temperature, or yields low working capacity","Report working capacity, regeneration temperature or vacuum level, humidity and impurity conditions, and compare materials on a process-level functional basis","(4,5,13)"
Sorbent loss and service life,The production burden of UiO-66-NH2 must be amortised over its useful operating life,High replacement loss can erase the climate benefit of the adsorbent during CCS operation,"Report replacement rate, durability, and cyclic stability under realistic conditions",(5)
